{
  "$schema": "http://json-schema.org/draft-07/schema#",
  "$id": "https://github.com/curationsx/yolo/schemas/software-entry.schema.json",
  "title": "Software directory entry",
  "description": "Validates entries in software/entries.json. Fields are deliberately durable: no pricing, no feature inventories. See software/README.md.",
  "type": "object",
  "required": ["id", "name", "category", "primary_use", "deployment", "notable_strength", "verify_before_use", "reference"],
  "additionalProperties": false,
  "allOf": [
    {
      "if": {
        "properties": {
          "review_status": { "const": "verified" }
        },
        "required": ["review_status"]
      },
      "then": {
        "required": ["last_reviewed"]
      }
    }
  ],
  "properties": {
    "id": {
      "type": "string",
      "pattern": "^[a-z0-9]+(-[a-z0-9]+)*$",
      "description": "Unique slug."
    },
    "name": {
      "type": "string",
      "minLength": 1,
      "description": "The tool's name."
    },
    "entity_type": {
      "type": "string",
      "enum": ["tool", "company", "platform", "project"],
      "description": "What the directory entry primarily represents."
    },
    "featured": {
      "type": "boolean",
      "description": "Editorial flag for the featured directory rail. Community votes inform, but do not automatically control, this flag."
    },
    "category": {
      "type": "string",
      "enum": ["research", "model-access", "automation", "observability-evaluation", "knowledge-data", "development", "design-content", "community-documentation"],
      "description": "Directory category."
    },
    "primary_use": {
      "type": "string",
      "minLength": 10,
      "description": "One sentence: the job this tool does."
    },
    "deployment": {
      "type": "string",
      "enum": ["local", "self-hosted", "cloud", "hybrid"],
      "description": "Deployment shape."
    },
    "notable_strength": {
      "type": "string",
      "minLength": 10,
      "description": "One durable, defensible strength. No superlatives you can't support."
    },
    "verify_before_use": {
      "type": "string",
      "minLength": 10,
      "description": "The trade-off or question a user should verify directly with the vendor."
    },
    "reference": {
      "type": "string",
      "pattern": "^https://",
      "description": "Official project/site URL."
    },
    "license": {
      "type": "string",
      "enum": ["open-source", "source-available", "open-weight", "proprietary-free-tier", "proprietary", "mixed"],
      "description": "Coarse licensing posture. These buckets are deliberately not interchangeable: open-source (OSI-style license), source-available (visible source, restricted use — e.g. fair-code), open-weight (model weights downloadable, license may restrict), proprietary-free-tier (closed source with a usable free tier), proprietary (closed source, paid), mixed (meaningfully different licenses across components). Verify the exact license directly before adoption."
    },
    "source_repository": {
      "type": "string",
      "pattern": "^https://",
      "description": "Official public source repository URL, when one exists."
    },
    "platforms": {
      "type": "array",
      "minItems": 1,
      "items": {
        "type": "string",
        "enum": ["Linux", "macOS", "Windows", "Web", "iOS", "Android"]
      },
      "description": "Platforms with first-party support."
    },
    "last_reviewed": {
      "type": "string",
      "pattern": "^\\d{4}-\\d{2}-\\d{2}$",
      "description": "Date (YYYY-MM-DD) a maintainer last reviewed this entry's fields against official sources."
    },
    "review_status": {
      "type": "string",
      "enum": ["verified", "needs-review"],
      "description": "verified = fields checked against official sources on last_reviewed date; needs-review = flagged for re-verification."
    },
    "tags": {
      "type": "array",
      "items": {
        "type": "string",
        "pattern": "^[a-z0-9]+(-[a-z0-9]+)*$"
      },
      "description": "Lowercase slugs for cross-cutting traits (e.g. local-first, self-hostable)."
    }
  },
  "definitions": {
    "collection": {
      "title": "Software entries collection",
      "type": "object",
      "required": ["version", "entries"],
      "properties": {
        "$schema": { "type": "string" },
        "version": { "type": "string", "pattern": "^\\d+\\.\\d+\\.\\d+$" },
        "entries": {
          "type": "array",
          "items": { "$ref": "#" }
        }
      }
    }
  }
}
